employer,employer_display,filing_count,quarters_present,quarters,repeat_sponsor,soc_codes,soc_titles,worksite_states,worksite_cities,wage_annual_min,wage_annual_median,wage_annual_max
TECHIE ASSOCIATES,"Techie Associates, LLC",10,1,FY2025Q4,no,15-1252,Software Developers,FL; NJ; OR; WY,CHEYENNE; JACKSONVILLE; Jacksonville; Lake Mary; Plainsboro; SALEM,75500,92000,103300
ASTUTE SOLUTIONS,Astute Solutions LLC,9,1,FY2025Q4,no,15-1252,Software Developers,CA; TX,Austin; Folsom; Mather; McKinney; Rancho Cordova; Sacramento,84094,100090,100090
AMERICAN TECHNOLOGY GROUP,AMERICAN TECHNOLOGY GROUP LLC,8,1,FY2025Q4,no,15-1252; 15-1299,Information Technology Project Managers; Software Developers,CA; FL; GA; NC; NJ; RI; WI,ATLANTA; FRANKLIN; HEATHROW; MENLO PARK; MOORESVILLE; SAN FRANCISCO; WEEHAWKEN; WOONSOCKET,55141,83450,135699
DIGITAL TECHNOLOGIES,DIGITAL TECHNOLOGIES LLC,8,1,FY2025Q4,no,15-1252,Software Developers,MA; MD; NC; NY; TX,APEX; BOSTON; COLUMBIA; IRVING; NEW YORK; PLANO,90896,92331,107557
THIRTHASOFT,"ThirthaSoft, LLC",8,1,FY2026Q1,no,15-1252,Software Developers,GA; NC; NJ,Atlanta; Charlotte; Decatur; Morris Plains,88000,88000,103210
VISAM TECHNOLOGIES,Visam Technologies Inc.,8,1,FY2025Q4,no,15-1252,Software Developers,CO; TX; VA; WA,Alexandria; Bothell; Dallas; Englewood; Frisco; Roanoke; Westlake,90896,94817,117749
3D TECHNOLOGIES,3D TECHNOLOGIES LLC,7,1,FY2025Q4,no,15-1252; 15-1299,Information Technology Project Managers; Software Developers,MI; MO; NJ; TX; VA,ASHBURN; DALLAS; DEARBORN; Dallas; FALLEN; NORTH BRUNSWICK,62525,90896,101421
BRANTA GROUP,BRANTA GROUP INC,7,1,FY2026Q1,no,15-1211; 15-1252,Computer Systems Analysts; Software Developers,CA; NC; NE,Morrisville; Omaha; PLEASANTON; Sunnyvale,65832,98758,135699
CLOUD360,CLOUD360 INC,7,1,FY2025Q4,no,15-1252; 15-1299,"Computer Occupations, All Other; Software Developers",CT; FL; NJ; NY,Albany; Bloomfield; Jersey City; Orlando; Parsippany; Princeton,62525,63000,78000
COLLASYS,Collasys LLC,7,1,FY2025Q4,no,15-1252,Software Developers,CO; FL; MI; NC; PA,Angier; Lansing; Mechanicsburg; Parker; Saint Augustine,70803,77106,98800
GSPANN TECHNOLOGIES,"GSPANN TECHNOLOGIES, INC.",7,1,FY2025Q4,no,15-1252,Software Developers,CA; WA,Alameda; Fremont; Rocklin; San Francisco; Seattle,123660,146435,154736
MACHINE LEARNING TECHNOLOGIES,MACHINE LEARNING TECHNOLOGIES LLC,7,1,FY2025Q4,no,15-1252,Software Developers,CA; CO; FL; GA; NY; WA,ATLANTA; LITTLETON; LOS ANGELES; NEW YORK; ORLANDO; REDMOND,77251,98738,117749
MYAPPSHUB,MYAPPSHUB LLC,7,1,FY2026Q1,no,15-1211,Computer Systems Analysts,WA,REDMOND; Redmond,92186,92186,92186
QUANTUM TECHNOLOGIES,QUANTUM TECHNOLOGIES LLC,7,1,FY2025Q4,no,15-1252,Software Developers,AR; FL; MD; OH; RI; TX,BENTONVILLE; CINCINNATI; LINTHICUM HEIGHTS; PLANO; SMITHFIELD; Southlake; TAMPA,64376,90418,92955
SAVVIENTS,Savvients Inc,7,1,FY2025Q4,no,15-1252,Software Developers,AZ; TX,Chandler; Phoenix; Plano; San Antonio,87672,88200,96000
STRATEGIC RESOURCES INTERNATIONAL,Strategic Resources International Inc,7,1,FY2025Q4,no,15-1252,Software Developers,DC; NC; TX,Apex; Austin; Durham; Washington,90355,91707,101421
SUNRISE TECHNOLOGIES,SUNRISE TECHNOLOGIES LLC,7,1,FY2025Q4,no,15-1252,Software Developers,AZ; IL; OR; TX; VA,CHICAGO; KLEIN; PHOENIX; PORTLAND; RESTON; WALLER,84094,87651,102898
URSI TECHNOLOGIES,"Ursi Technologies, Inc.",7,1,FY2025Q4,no,15-1252,Software Developers,CA; GA; NC; WI,Alpharetta; Cumming; Raleigh; San Jose; Waukesha,79040,93000,149365
ABHYANTH SOLUTIONS,ABHYANTH SOLUTIONS INC,6,1,FY2025Q4,no,15-1252,Software Developers,KS; NJ; PA; TX; VA,MALVERN; MCLEAN; MEDFORD; OVERLAND PARK; PLANO,80080,88088,101421
ARTIFICIAL INTELLIGENCE TECHNOLOGIES,ARTIFICIAL INTELLIGENCE TECHNOLOGIES LLC,6,1,FY2025Q4,no,15-1211; 15-1252,Computer Systems Analysts; Software Developers,FL; GA; IL; NJ; NY,CHILLICOTHE; CORAL GABLES; DAYTON; DULUTH; DUNWOODY; NEW YORK,67787,87859,103210
AUGMENTED REALITY TECHNOLOGIES,AUGMENTED REALITY TECHNOLOGIES LLC,6,1,FY2026Q1,no,15-1252,Software Developers,IL,CHICAGO,85467,85467,85467
GB TECH,"GB Tech, Inc.",6,1,FY2025Q4,no,15-1211; 15-1252,Computer Systems Analysts; Software Developers,DE; NH; TX; VA,Houston; McLean; Merrimack; Middletown,69077,88088,102419
GOLDMAN SACHS SERVICES,GOLDMAN SACHS SERVICES LLC,6,1,FY2025Q4,no,15-1252,Software Developers,TX; UT,Dallas; Salt Lake City,95000,115500,120000
MACROSOFT,"Macrosoft, Inc.",6,1,FY2025Q4,no,15-1252,Software Developers,NJ; NY,Bedminster; New York,116480,124800,124800
PRELUDE SYSTEMS,PRELUDE SYSTEMS INC.,6,1,FY2025Q4,no,15-1252,Software Developers,CA; CT; MO; OH,Clayton; GLASTONBURY; Liberty Township; Los Angeles; San Dimas,102000,110272,121706
TRANSNATIVE ASSOCIATES,"TRANSNATIVE ASSOCIATES, INC.",6,1,FY2025Q4,no,15-1252,Software Developers,CA,Mountain View; SAN JOSE; SANTA CLARA,149365,149365,149365
VISIONSOFT,VISIONSOFT INC,6,1,FY2025Q4,no,15-1252,Software Developers,FL; MI; NJ; TX,BOCA RATON; DEARBORN; JUNO BEACH; PARSIPPANY; Plano,91520,93600,108160
BEACONFIRE STAFFING SOLUTIONS,BEACONFIRE STAFFING SOLUTIONS INC.,5,1,FY2025Q4,no,15-1252; 15-1299,Document Management Specialists; Software Developers,DE; MO; NJ; UT,EAST WINDSOR; JERSEY CITY; O FALLON; SALT LAKE CITY; WILMINGTON,63300,80538,103210
BLOCKCHAIN TECHNOLOGIES,BLOCKCHAIN TECHNOLOGIES LLC,5,1,FY2025Q4,no,15-1252,Software Developers,CA; GA; IL; NY; TX,ATLANTA; CHICAGO; MOUNTAIN VIEW; NEW YORK; PLANO,85467,90896,149365
CLIENTSERVER TECHNOLOGY SOLUTIONS,ClientServer Technology Solutions LLC,5,1,FY2025Q4,no,15-1252,Software Developers,CT; NC; NJ; TX,Iselin; Plano; Raleigh; Round Rock; South Windsor,91000,95000,96000
CYBERSOLVE IT,"CyberSolve IT, Inc.",5,1,FY2025Q4,no,15-1252,Software Developers,CO; TX; VA,Colorado Springs; Irving; Mechanicsville; Plano; Westlake,83637,90896,93974
DATAD SOLUTIONS INC DBA ACRM,"DataD Solutions, Inc. DBA- ACRM",5,1,FY2025Q4,no,15-1252,Software Developers,TX; VA,Cedar Park; McLean; Sugar Land; Westlake,84094,90355,101421
EFICENS SYSTEMS,EFICENS SYSTEMS INC,5,1,FY2025Q4,no,15-1252,Software Developers,GA; NV; TX,ATLANTA; AUSTIN; CUMMING; JOHNS CREEK; LAS VEGAS,85000,88000,90500
EPSOFT TECHNOLOGIES,EPSoft Technologies LLC,5,1,FY2025Q4,no,15-1252,Software Developers,IN; NY; TX; WA,Bellevue; Indianapolis; New York; Plano,90896,90896,118000
GLOBAL DIGITAL RESOURCES,Global Digital Resources LLC,5,1,FY2025Q4,no,15-1252,Software Developers,FL; TX,Addison; Jacksonville; Richardson,84000,91500,103000
ITEK INFO,Itek Info Inc,5,1,FY2026Q1,no,15-1252,Software Developers,WA,Bothell,118000,118000,118000
KUBEX TECHNOLOGIES,Kubex Technologies,5,1,FY2025Q4,no,15-1252,Software Developers,NJ; TX,Irving; Newark,90900,90900,103250
MACHINE INTELLIGENCE,MACHINE INTELLIGENCE LLC,5,1,FY2026Q1,no,15-1252,Software Developers,IL,CHICAGO,85467,85467,85467
MAGTECH CONSULTING AND SOLUTIONS DEVELOPMENT CORPORATION,MAGTECH CONSULTING AND SOLUTIONS DEVELOPMENT CORPORATION,5,1,FY2025Q4,no,15-1252,Software Developers,CA; NJ; NY,BERKELEY HEIGHTS; BOUND BROOK; NEW YORK; PASADENA,102232,103210,103300
NAVY FEDERAL CREDIT UNION,Navy Federal Credit Union,5,1,FY2025Q4,no,15-1252,Software Developers,VA; WA,Snohomish; Vienna,105805,109013,137446
OSS,"OSS, Inc.",5,1,FY2025Q4,no,15-1252,Software Developers,CA; CO; MD; NY; OH,Albany; Dublin; Parker; Pasadena; Rockville,78000,88483,102232
PRUTECH SOLUTIONS,"PRUTECH SOLUTIONS, INC.",5,1,FY2025Q4,no,15-1252,Software Developers,NJ; NY; TX,GRAND PRAIRIE; HARRISON; ISELIN; NEW YORK,100000,104000,113400
SATIN SOLUTIONS,SATIN SOLUTIONS LLC,5,1,FY2025Q4,no,15-1252,Software Developers,NJ; OR; PA,Erie; Portland; Somerset,69000,102900,103300
SAXON GLOBAL,Saxon Global Inc.,5,1,FY2025Q4,no,15-1299,Computer Systems Engineers/Architects,CA; WA,Bellevue; Fremont; Redmond; Sunnyvale,83824,97594,4358848
SOFTTECHERS,Softtechers LLC,5,1,FY2025Q4,no,15-1252,Software Developers,GA; NC,Atlanta; Charlotte,87859,87859,91291
SUNLIGHT TECHNOLOGIES,SunLight Technologies Inc,5,1,FY2025Q4,no,15-1252,Software Developers,GA; NJ; NY; TX,"Duluth; Edison; Irving; New York,",87900,103250,103250
TALENT TRUST TECH,Talent Trust Tech Inc,5,1,FY2025Q4,no,15-1252,Software Developers,MI,Farmington Hills; Lansing,85000,85000,88000
ACQUIS CONSULTING,ACQUIS CONSULTING INC,4,1,FY2025Q4,no,15-1252,Software Developers,GA; NJ; WA,Bothell; Johns Creek; Parsippany,87859,108000,117749
AH INFOTECH,AH Infotech LLC,4,1,FY2025Q4,no,15-1252,Software Developers,NJ; NY,Monmouth Junction; New York,95493,103210,103210
AIRCALL IO,"Aircall.io, Inc.",4,1,FY2026Q1,no,15-1252,Software Developers,CA; WA,Bellevue; San Francisco,150000,190000,240000
AORTON,Aorton Inc,4,1,FY2025Q4,no,15-1252,Software Developers,KS,Overland Park,76086,76086,76086
ARDOR IT SYSTEMS,ARDOR IT SYSTEMS LLC,4,1,FY2025Q4,no,15-1252,Software Developers,CA; NC; TX,CHARLOTTE; GLENDALE; PLANO,90896,96762,117749
ASTIR SERVICES,ASTIR SERVICES LLC,4,1,FY2025Q4,no,15-1252,Software Developers,GA; NJ,Alpharetta; Berkeley Heights; Manalapan,88000,103500,103500
AUTOMATION TECHNOLOGIES,AUTOMATION TECHNOLOGIES LLC,4,1,FY2025Q4,no,15-1211; 15-1252,Computer Systems Analysts; Software Developers,GA; IL; IN; TX,ATLANTA; INDIANAPOLIS; NORTHBROOK; WESTLAKE,77730,81682,87859
CLARKSTECH,ClarksTech LLC,4,1,FY2026Q1,no,15-1252,Software Developers,NJ,Berkeley Heights,103210,103210,103210
CLOUD HYBRID TECHNOLOGIES,CLOUD HYBRID TECHNOLOGIES LLC,4,1,FY2025Q4,no,15-1252; 15-1299,Information Technology Project Managers; Software Developers,CA; NJ; PA,BRIDGEWATER TOWNSHIP; MALVERN; STANFORD,62525,118726,149365
CONSULTING OPPORTUNITY HOLDINGS,CONSULTING OPPORTUNITY HOLDINGS LLC,4,1,FY2025Q4,no,15-1252,Software Developers,GA; TX,Alpharetta; Dallas,87859,87859,90896
COULOIR TECHNOLOGY GROUP,"Couloir Technology Group, Inc",4,1,FY2026Q1,no,15-1252; 15-1299,Computer Systems Engineers/Architects; Software Developers,WA,Redmond,83824,100786,117749
ECERA SYSTEM,Ecera System LLC,4,1,FY2025Q4,no,15-1252,Software Developers,CA; MI,Farmington Hills; Irvine,103000,105000,176800000
GEMINI CONSULTING SERVICES,"Gemini Consulting & Services, LLC",4,1,FY2025Q4,no,15-1252,Software Developers,DC; NC; NE; NJ,Berkeley Heights; La Vista; Research Triangle Park; Washington,84531,99460,103210
GENIEPRO TECHNOLOGIES,GeniePro Technologies Inc,4,1,FY2025Q4,no,15-1252,Software Developers,GA,Alpharetta; Atlanta,87859,87859,87859
GLOBAL APPS,Global Apps Inc.,4,1,FY2025Q4,no,15-1252,Software Developers,AZ; CA; FL; MA,Mesa; Palm Beach Gardens; Sunnyvale; Wilmington,83658,97604,149365
INSPIRISYS SOLUTIONS NORTH AMERICA,"Inspirisys Solutions North America, Inc.",4,1,FY2026Q1,no,15-1252,Software Developers,CA; WA,San Diego; Vancouver,102898,115638,116275
INTELLYK,Intellyk Inc.,4,1,FY2025Q4,no,15-1211; 15-1252; 15-1299,Computer Systems Analysts; Information Technology Project Managers; Software Developers,CA; NJ; TX; WA,Bellevue; Bridgewater; Glendale; PLANO,75000,85000,102500
KOSMA TECH,Kosma Tech Inc,4,1,FY2025Q4,no,15-1252,Software Developers,CT; GA; TX,Alpharetta; Dallas; Hartford,88000,91000,101000
MEJENTA SYSTEMS,"Mejenta Systems, Inc",4,1,FY2025Q4,no,15-1252,Software Developers,IL; OH,Columbus; Rosemont,87000,90646,91291
MINDEX TECHNOLOGIES,"Mindex Technologies, Inc.",4,1,FY2025Q4,no,15-1252,Software Developers,NY,Rochester,79997,85020,90896
MINDSPECS,Mindspecs LLC,4,1,FY2025Q4,no,15-1252,Software Developers,TX; WA,Bellevue; Irving,90896,90896,117749
NENINE TECHNOLOGIES,Nenine Technologies Inc,4,1,FY2025Q4,no,15-1299,"Computer Occupations, All Other",CA; TX,San Antonio; Sunnyvale; Torrance,70000,85000,98000
PRIME HEALTHCARE MANAGEMENT,"Prime Healthcare Management, Inc.",4,1,FY2025Q4,no,15-1252; 15-1299,"Computer Occupations, All Other; Computer Systems Engineers/Architects; Software Developers",CA; TX,Harlingen; Ontario,65562,87131,101920
PROMATRIX,PROMATRIX CORP,4,1,FY2025Q4,no,15-1252,Software Developers,MD; PA; TX; VA,Fredrick; MECHANICSBURG; PLANO; Reston,75000,94100,97200
PY DATA SOLUTIONS,"PY DATA SOLUTIONS, INC",4,1,FY2025Q4,no,15-1252,Software Developers,NJ; TX,Edison; IRVING; irving,90896,91302,103210
SAIN TECHNOLOGIES,Sain Technologies LLC,4,1,FY2025Q4,no,15-1252,Software Developers,NJ; TX; VA,Iselin; Manassas; Plano,90896,102315,103210
SNOWSTACK,Snowstack LLC,4,1,FY2025Q4,no,15-1252,Software Developers,NC; NJ; TX; VA,Austin; Charlotte; Tysons; Whippany,90355,96356,103210
SP TECH RESOURCES,SP Tech Resources Inc,4,1,FY2025Q4,no,15-1252,Software Developers,CA; GA; TX,Alpharetta; Austin; SAN RAMON,87859,90355,135699
SRD INFOTEK,SRD INFOTEK INC,4,1,FY2025Q4,no,15-1252,Software Developers,CA; NJ,Bridgewater; Sunnyvale; Union,103210,131882,149365
SYNOPSYS,"Synopsys, Inc.",4,1,FY2026Q1,no,15-1252,Software Developers,IL; NC; PA,Apex; Canonsburg; Evanston,76918,82254,91707
SYSTEM SOFT TECHNOLOGIES,"SYSTEM SOFT TECHNOLOGIES, LLC",4,1,FY2025Q4,no,15-1252,Software Developers,NC; TX,Charlotte; Pflugerville; Salisbury,93600,93800,94000
VENA PORTAE,VENA PORTAE INC,4,1,FY2025Q4,no,15-1211; 15-1252,Computer Systems Analysts; Software Developers,CO; PA,Broomfield; King of Prussia,86154,87121,88088
YKUNT,Ykunt Inc,4,1,FY2025Q4,no,15-1252,Software Developers,TN; TX,Houston; Nashville; Roanoke,84100,88000,91000
4CONSULTING,"4CONSULTING, INC",3,1,FY2025Q4,no,15-1252; 15-1299,Computer Systems Engineers/Architects; Software Developers,CA; PA; TX,Austin; Gold River; Mechanicsburg,67000,87149,100000
9M SOLUTIONS,9M Solutions Inc.,3,1,FY2026Q1,no,15-1252,Software Developers,NJ; VA,Hamilton Township; Henrico,85821,85821,91707
ACEABLE IT,ACEABLE IT LLC,3,1,FY2025Q4,no,15-1252,Software Developers,OK; TX,Houston; Tulsa,68349,85000,85000
ADVANCED RESOURCE STAFFING,Advanced Resource Staffing Inc,3,1,FY2026Q1,no,15-1252,Software Developers,AZ; CA; DC,Antioch; Phoenix; Washington,96768,101421,135699
AIRBNB,"AIRBNB, INC.",3,1,FY2025Q4,no,15-1252,Software Developers,CA; NY,New York; San Francisco,157000,157000,157000
ALTPLUS,ALTPLUS LLC,3,1,FY2025Q4,no,15-1252,Software Developers,MN; PA,EDEN PRAIRIE; HOPKINS; MALVERN,88000,88088,90896
ANAGH TECHNOLOGIES,Anagh Technologies Inc,3,1,FY2025Q4,no,15-1252,Software Developers,CA; NJ; PA,Bensalem; Cranford; Sunnyvale,88400,104000,149760
APEX IT SYSTEMS GLOBAL USA,"Apex IT Systems Global USA, LLC.",3,1,FY2025Q4,no,15-1252; 15-1299,"Computer Occupations, All Other; Software Developers",TX,McKinney; Northlake,66726,66726,90896
APPIAN CORPORATION,Appian Corporation,3,1,FY2025Q4,no,15-1252,Software Developers,CA; MD; NY,Baltimore; Brooklyn; San Jose,110365,130000,174794
ARMADA SYSTEMS,"Armada Systems, Inc.",3,1,FY2026Q1,no,15-1252,Software Developers,WA,Bellevue,128000,135000,135000
ASB RESOURCES,ASB RESOURCES,3,1,FY2025Q4,no,15-1252,Software Developers,NC; NJ,Charlotte; Iselin; Warren,120000,120000,120000
AT T SERVICES,"AT&T SERVICES, INC.",3,1,FY2025Q4,no,15-1252; 15-1299,Information Technology Project Managers; Software Developers,NJ; TX; WA,BOTHELL; MIDDLETOWN; Plano,140000,145000,175000
ATHREYA,"Athreya, Inc.",3,1,FY2025Q4,no,15-1252,Software Developers,NJ,EDISON; Edison,103500,103500,103500
AUGER,Auger Inc.,3,1,FY2025Q4,no,15-1252,Software Developers,WA,Bellevue,230000,230000,230000
AVIDXCHANGE,"AvidXchange, Inc.",3,1,FY2026Q1,no,15-1252,Software Developers,CA,San Diego,116000,116000,116000
BLUERIDGE INFOTECH,Blueridge Infotech Corp,3,1,FY2025Q4,no,15-1252,Software Developers,NJ; TX; VA,McLean; Piscataway; San Antonio,90000,101500,103500
BLUVIUM,Bluvium Inc.,3,1,FY2025Q4,no,15-1252,Software Developers,TX,The Woodlands,90000,90000,90000
BRILLIANT INFOTECH,BRILLIANT INFOTECH INC.,3,1,FY2025Q4,no,15-1252,Software Developers,NJ,BERKLEY HEIGHTS; EDISON; TRENTON,103400,110000,110000
C TEKK SOLUTIONS,C TEKK SOLUTIONS INC,3,1,FY2025Q4,no,15-1252,Software Developers,TX,DALLAS; Dallas,90896,90896,90896
CENTRAK,"CenTrak, Inc.",3,1,FY2025Q4,no,15-1211,Computer Systems Analysts,WA,Bothell,92031,92186,92186
CINERGY TECHNOLOGY,"Cinergy Technology, Inc",3,1,FY2025Q4,no,15-1252,Software Developers,NJ; TX,Frisco; Monmouth Junction; Mount Holly,89440,93000,103500
CITIBANK N A,"Citibank, N.A.",3,1,FY2025Q4,no,15-1252,Software Developers,FL; NJ; NY,Getzville; Jersey City; Tampa,93950,98175,124900
CODEREPO,CodeRepo LLC,3,1,FY2025Q4,no,15-1252,Software Developers,GA; IL,Cumming; Waukegan,90000,93000,110000
DATICS,DATICS INC,3,1,FY2025Q4,no,15-1252,Software Developers,IL; TX,Denton; Lisle; Plano,85467,90896,90896
DIGITAL DATUM,DIGITAL DATUM INC,3,1,FY2025Q4,no,15-1252,Software Developers,GA; TX,Alpharetta; Dallas; Irving,91000,91000,95000
DIGITAL ITECHNOLOGY,Digital iTechnology LLC,3,1,FY2025Q4,no,15-1252; 15-1299,Document Management Specialists; Software Developers,OH; TX,Austin; Parma Heights; STRONGSVILLE,61298,79040,79040
ELEMENT TECHNOLOGIES,ELEMENT TECHNOLOGIES INC,3,1,FY2025Q4,no,15-1211; 15-1252,Computer Systems Analysts; Software Developers,IL; MA; VA,BROADLANDS; CHELMSFORD; CHICAGO,84344,85467,86258
ELITE EMANATE,Elite Emanate LLC,3,1,FY2025Q4,no,15-1252,Software Developers,NJ; NY; VA,EDISON; HERNDON; HICKSVILLE,101920,103210,104000
EMERGTECH BUSINESS SOLUTIONS,"Emergtech Business Solutions, Inc",3,1,FY2025Q4,no,15-1211; 15-1252,Computer Systems Analysts; Software Developers,MI; TX; VA,Fairfax; Farmington Hills; Oak Point,73840,90896,102190
ENTERPRISE MOBILITY,Enterprise Mobility Inc,3,1,FY2025Q4,no,15-1252; 15-1299,Computer Systems Engineers/Architects; Information Technology Project Managers; Software Developers,CA; PA; VA,Newark; Pittsburgh; WINCHESTER,80000,80560,81120
ERP WIZ,ERP WIZ INC,3,1,FY2025Q4,no,15-1252,Software Developers,AZ; OK; TX,Irving; Oklahoma; Phoenix,72426,84094,90896
FIRST SOFT SYSTEMS,First Soft Systems LLC,3,1,FY2025Q4,no,15-1252,Software Developers,AZ,Phoenix,89440,97760,97760
GAINWELL TECHNOLOGIES,Gainwell Technologies LLC,3,1,FY2025Q4,no,15-1252; 15-1299,"Computer Occupations, All Other; Software Developers",TX,El Paso; Liberty Hill; Round Rock,61298,77002,90355
GOLDMAN SACHS CO,GOLDMAN SACHS & CO. LLC,3,1,FY2025Q4,no,15-1252,Software Developers,TX,Dallas,100000,103400,103400
GS GLOBAL SERVICES,GS Global Services Inc.,3,1,FY2025Q4,no,15-1252,Software Developers,NH,Rochester,85000,107557,107557
I CONNECT LC,"I-CONNECT, LC",3,1,FY2025Q4,no,15-1252,Software Developers,MA; TX,IRVING; Richardson; Waltham,91000,98000,100000
IBASE OPERATIONS,Ibase Operations Corp.,3,1,FY2025Q4,no,15-1299,Information Technology Project Managers,CA; WA,Kirkland; Union City,90000,90000,100737
INDUS RIVER TECHNOLOGIES,Indus River Technologies Inc,3,1,FY2025Q4,no,15-1211; 15-1252,Computer Systems Analysts; Software Developers,NC; PA; TX,Cary; Fort Worth; Oaks,78000,88088,91707
INFOTECH PRISM,INFOTECH PRISM LLC,3,1,FY2025Q4,no,15-1252,Software Developers,GA,Alpharetta,82971,82971,87859
INHERENT TECHNOLOGIES,"INHERENT TECHNOLOGIES, LLC",3,1,FY2025Q4,no,15-1252; 15-1299,Information Technology Project Managers; Software Developers,DE; RI,WILMINGTON; WOONSOCKET,65395,65395,104000
INTERGRAPH CORPORATION,Intergraph Corporation,3,1,FY2025Q4,no,15-1252; 15-1299,Information Technology Project Managers; Software Developers,CA; MA,Milford; San Jose; Wilmington,98000,100000,115000
LAUNCH IT,LAUNCH IT CORP,3,1,FY2025Q4,no,15-1252,Software Developers,IA; TX,Plano; Urbandale,84760,84760,4726592
MARSHALL TECHNOLOGIES,Marshall Technologies Inc.,3,1,FY2025Q4,no,15-1211; 15-1252,Computer Systems Analysts; Software Developers,DE; TX,San Antonio; Wilmington,69056,69077,85446
MEASURED ANALYTICS,"Measured Analytics, Inc.",3,1,FY2025Q4,no,15-1252,Software Developers,CA,Irvine,110000,110000,110000
MENZO TECHNOLOGIES,Menzo Technologies Corp,3,1,FY2025Q4,no,15-1252,Software Developers,MA; TX,Dallas; Plano; Quincy,90896,90896,107557
MOLABS MEDIA,Molabs Media LLC,3,1,FY2025Q4,no,15-1211; 15-1252,Computer Systems Analysts; Software Developers,TX,Dallas,80000,84100,91000
MYGO CONSULTING,Mygo Consulting Inc.,3,1,FY2025Q4,no,15-1252,Software Developers,CA; IL; OR,Beaverton; Riverwoods; Tracy,85500,91000,103000
NAVTEK SOLUTIONS,NavTek Solutions Inc,3,1,FY2025Q4,no,15-1252,Software Developers,AR; OH,Columbus; Little Rock,65562,82846,82846
NGTALENTTECH GROUP,NGTalentTech Group LLC,3,1,FY2025Q4,no,15-1252; 15-1299,Computer Systems Engineers/Architects; Software Developers,CA; TX,Houston; Mountain View; Plano,91000,91000,98000
NILE TECH,NILE TECH INC.,3,1,FY2025Q4,no,15-1252,Software Developers,NJ; VA,Hampton; Jersey City; Vienna,101421,103210,103210
NUVIEW TECHNOLOGIES,"NUVIEW TECHNOLOGIES, INC.",3,1,FY2025Q4,no,15-1252; 15-1299,Information Security Engineers; Software Developers,GA; IN; TX,Alpharetta; Bloomington; Houston,64500,66000,84100
ORABASE SOLUTIONS,ORABASE SOLUTIONS LLC,3,1,FY2025Q4,no,15-1252,Software Developers,CT; MD; TX,Columbia; HOUSTON; New Britain,84094,92955,97614
PILOT TECHNOLOGIES,Pilot Technologies LLC,3,1,FY2025Q4,no,15-1252,Software Developers,MO,St. Louis,76045,85000,85000
PRO IT,"Pro IT, Inc.",3,1,FY2026Q1,no,15-1252,Software Developers,MO,Chesterfield,90896,90896,96000
PVR AMERICA,PVR AMERICA INC,3,1,FY2025Q4,no,15-1252; 15-1299,"Computer Occupations, All Other; Software Developers",CO; GA,Alpharetta; Highlands Ranch,61693,76627,87859
QUALTRICS,"Qualtrics, LLC",3,1,FY2025Q4,no,15-1252,Software Developers,WA,Seattle,120000,120000,148500
R SYSTEMS,R SYSTEMS INC.,3,1,FY2025Q4,no,15-1252,Software Developers,CA; TX,COPPELL; EL DORADO HILLS,101000,101000,103000
RLT TECHNOLOGIES,"RLT Technologies, Inc",3,1,FY2026Q1,no,15-1211; 15-1252,Computer Systems Analysts; Software Developers,VA,RESTON; Reston,86000,102000,102000
S R INTERNATIONAL,"S R International, Inc.",3,1,FY2026Q1,no,15-1252,Software Developers,NJ; PA,Basking Ridge; Malvern,104000,117000,118560
SACROSANCTINFO,SACROSANCTINFO LLC,3,1,FY2026Q1,no,15-1252,Software Developers,CA; NJ; TX,Live Oak; Stratford; Sunnyvale,85446,91000,149365
SAI BUSINESS SOLUTIONS,Sai Business Solutions LLC,3,1,FY2026Q1,no,15-1211; 15-1252,Computer Systems Analysts; Software Developers,TX,HOUSTON; Houston; KATY,75500,75500,84094
SASINFO,SASInfo Inc,3,1,FY2025Q4,no,15-1211,Computer Systems Analysts,CO; TX; WI,Greenwood Village; Little Elm; Madison,70034,77730,77730
SHIRO TECHNOLOGIES,"SHIRO TECHNOLOGIES, LLC",3,1,FY2025Q4,no,15-1252,Software Developers,NV; TX,ADDISON; LAS VEGAS,85000,90896,90896
SIERRA CONSULTING,Sierra Consulting Inc.,3,1,FY2025Q4,no,15-1252,Software Developers,GA; IL,Atlanta; Chicago; Itasca,85467,87859,102690
SIMAN PRO,SIMAN PRO INC,3,1,FY2025Q4,no,15-1252,Software Developers,CA; FL; TX,Beverly Hills; Celina; Temple Terrace,91000,100000,102300
SKY EDGE SYSTEMS,SKY EDGE SYSTEMS LLC,3,1,FY2025Q4,no,15-1252,Software Developers,NJ,JERSEY CITY,103210,103210,103210
SPARTAN TECHNOLOGY,SPARTAN TECHNOLOGY INC,3,1,FY2025Q4,no,15-1252,Software Developers,AZ; CA; NC,Charlotte; Irvine; Phoenix,90000,92000,104000
SPINO,Spino Inc,3,1,FY2025Q4,no,15-1252,Software Developers,GA; TX; WA,Atlanta; Bothell; Georgetown,87900,117750,4700800
STARTEKK,STARTEKK LLC,3,1,FY2025Q4,no,15-1252,Software Developers,TX,Fortworth; Plano,90896,90896,90896
SUNSTRONG MANAGEMENT,"SunStrong Management, LLC",3,1,FY2025Q4,no,15-1252,Software Developers,TX,Houston,84094,84094,84094
SUSQUEHANNA INTERNATIONAL GROUP LLP,"Susquehanna International Group, LLP",3,1,FY2026Q1,no,15-1252,Software Developers,PA,Bala Cynwyd,88100,88100,88100
TEK RUBIX,Tek Rubix LLC,3,1,FY2025Q4,no,15-1252,Software Developers,IL; MN,Buffalo Grove; Lakeville,84448,84448,85467
TEKCOMMANDS,TeKCommands Inc,3,1,FY2026Q1,no,15-1252,Software Developers,PA; VA,Herndon; Philadelphia,88088,88088,101421
TEKPROS,"TEKPROS, INC.",3,1,FY2025Q4,no,15-1211; 15-1252,Computer Systems Analysts; Software Developers,MI; NC; SC,FARMINGTON; Holly Springs; TEGACAY,75088,78312,84053
THE PRINCIPAL CONSULTING,"THE PRINCIPAL CONSULTING, INC.",3,1,FY2025Q4,no,15-1211; 15-1252,Computer Systems Analysts; Software Developers,CA; GA; VA,ALPHARETTA; DUBLIN; RICHMOND,83637,90000,98758
TIMESQUARE IT,TIMESQUARE IT INC,3,1,FY2025Q4,no,15-1252,Software Developers,AR; NC,Bentonville; Durham,94182,95000,100000
TOYOTA MATERIAL HANDLING,Toyota Material Handling Inc.,3,1,FY2026Q1,no,15-1252,Software Developers,NY,Greene,86054,93600,100172
UNITED SOFTWARE CORPORATION,United Software Corporation,3,1,FY2025Q4,no,15-1252,Software Developers,TX,Austin,85384,90355,95493
VELOCITY DATA SOLUTIONS,Velocity Data Solutions LLC,3,1,FY2025Q4,no,15-1252,Software Developers,AZ; NC,Chandler; Holly Springs,83100,91800,92000
VERASTRO,"Verastro,Inc",3,1,FY2025Q4,no,15-1252,Software Developers,CA,Mountain House,90438,90438,90438
VSPASTRA SOLUTIONS,VSPASTRA SOLUTIONS LLC,3,1,FY2025Q4,no,15-1252,Software Developers,NJ; TX,Beaumont; Edison; San Antonio,81432,85446,103210
XCEED TECHNOLOGIES,XCEED TECHNOLOGIES INC.,3,1,FY2026Q1,no,15-1252,Software Developers,MO; NJ,CREVE COEUR; METUCHEN,79040,103210,103210
XTRACIT,XTRACIT INC,3,1,FY2026Q1,no,15-1252,Software Developers,NC; TX,Plano; Raleigh,90896,90896,91707
YERRALPHA,YERRALPHA LLC,3,1,FY2025Q4,no,15-1252; 15-1299,Information Technology Project Managers; Software Developers,NC; TX,FRISCO; Frisco; Garner,86000,90896,91707
ZIFO TECHNOLOGIES,"ZIFO TECHNOLOGIES, INC",3,1,FY2025Q4,no,15-1299,Computer Systems Engineers/Architects; Information Technology Project Managers,MA; NJ; PA,Cambridge; Warren; West Point,75000,75000,80457
161 DEV,161 Dev Inc,2,1,FY2025Q4,no,15-1252,Software Developers,NJ; NY,Jersey City; NEW YORK,103500,103500,103500
3AMIGOSIT,3AMIGOSIT LLC,2,1,FY2025Q4,no,15-1252,Software Developers,TX,IRVING,91000,91000,91000
A A INFOSYSTEMS,"A&A Infosystems, Inc",2,1,FY2025Q4,no,15-1252,Software Developers,TX,Austin; Irving,90896,90896,90896
A D BANKER COMPANY,"A.D. Banker & Company, LLC",2,1,FY2026Q1,no,15-1252,Software Developers,KS,Overland Park,95242,95265,95288
A M IT SOLUTIONS,A&M IT SOLUTIONS LLC,2,1,FY2026Q1,no,15-1252,Software Developers,GA; NJ,Harrison; Lilburn,87900,95575,103250
AASRITA CONSULTING,"AASRITA CONSULTING, LLC.",2,1,FY2025Q4,no,15-1252,Software Developers,NJ; OH,CLEVELAND; MORRIS PLAINS,73000,88500,104000
ABCO COMPUTERS,ABCO COMPUTERS INC,2,1,FY2026Q1,no,15-1252,Software Developers,UT,Taylorsville,93600,93600,93600
