employer,employer_display,filing_count,quarters_present,quarters,repeat_sponsor,soc_codes,soc_titles,worksite_states,worksite_cities,wage_annual_min,wage_annual_median,wage_annual_max
AMAZON COM SERVICES,Amazon.com Services LLC,317,2,FY2025Q4; FY2026Q1,yes,15-1211; 15-1252; 15-1299,Computer Systems Analysts; Information Security Engineers; Information Technology Project Managers; Software Developers,AZ; CA; CO; FL; GA; MA; MD; NJ; NY; OR; TN; TX; VA; WA,ARLINGTON; AUSTIN; Arlington; Atlanta; Austin; BELLEVUE; Bellevue; Boston; Boulder; Culver City; Cumming; Cupertino; Dallas; East Palo Alto; Herndon; Hyattsville; Irvine; Irving; JERSEY CITY; Jersey City; Nashville; New York; North Reading; Portland; RUTHERFORD; Redmond; SAN FRANCISCO; SEATTLE; SUNNYVALE; San Diego; San Francisco; Santa Clara; Seattle; Sunnyvale; TEMPLE TERRANCE; Tempe; WESTBOROUGH; Westborough,72800,130400,185000
MICROSOFT CORPORATION,Microsoft Corporation,132,2,FY2025Q4; FY2026Q1,yes,15-1252; 15-1299,Computer Systems Engineers/Architects; Information Technology Project Managers; Software Developers,CA; FL; GA; MA; MD; NJ; NY; TX; VA; WA,Arlington; Atlanta; Damascus; East Syracuse; Elkridge; Framingham; Frisco; Houston; Irving; Jersey City; Long Island city; Long island city; Lynnwood; MILL CREEK; McKinney; Mckinney; Mountain View; Nacogdoches; New York; Plano; Redmond; Riverview; San Jose; Seattle; Sunnyvale; West New York,90896,134100,177200
DELOITTE CONSULTING LLP,Deloitte Consulting LLP,99,2,FY2025Q4; FY2026Q1,yes,15-1252,Software Developers,AL; AR; AZ; CA; DC; DE; FL; GA; IL; IN; KS; MA; MO; NC; NJ; NM; OH; PA; SC; TX; VA,Alpharetta; Apopka; Atlanta; Aubrey; Austin; Birmingham; Boston; Camp Hill; Cary; Centerton; Charlotte; Chicago; Columbus; Dallas; Farmers Branch; Frisco; Gilbert; Greenwood; Haymarket; Indian Land; Indianapolis; Irving; Jacksonville; Jersey City; Jourdanton; Kansas City; Kyle; Lake Mary; Long Beach; Los Angeles; Lutz; MECHANICSBURG; McLean; Mechanicsburg; Morrisville; Naperville; Overland Park; Philadelphia; Plano; Round Rock; Ruskin; Sandy Springs; Sanford; Santa Fe; Surprise; Tampa; Tracy; Washington; Wilmington; Woodstock; York,72405,91707,151700
AMAZON DEVELOPMENT CENTER U S,"Amazon Development Center U.S., Inc.",76,2,FY2025Q4; FY2026Q1,yes,15-1252; 15-1299,Information Security Engineers; Software Developers,CA; GA; MA; MI; NY; TX; VA; WA,Arlington; Atlanta; Austin; BOSTON; Bellevue; Boston; DETROIT; Dallas; East Palo Alto; Herndon; NEW YORK; New York; Redmond; SANTA CLARA; Santa Clara; Seattle,90896,129000,163240
AMAZON WEB SERVICES,"Amazon Web Services, Inc.",66,2,FY2025Q4; FY2026Q1,yes,15-1252; 15-1299,Information Security Engineers; Software Developers,CA; GA; NC; NJ; NY; PA; TX; VA; WA,ARLINGTON; Arlington; Atlanta; Austin; Bellevue; Cupertino; DALLAS; Dallas; EAST PALO ALTO; East Palo Alto; Herndon; Jersey City; Mountain View; New York; Raleigh; SEATTLE; Santa Clara; Scranton; Seattle; Sunnyvale,103210,129000,190000
COMCAST CABLE COMMUNICATIONS,"Comcast Cable Communications, LLC",36,2,FY2025Q4; FY2026Q1,yes,15-1252,Software Developers,CA; CO; NJ; PA; TX; VA; WA,Austin; Englewood; Houston; Leander; Mount Laurel; Philadelphia; Reston; Seattle; Sunnyvale; West Chester,79851,88088,149365
QUADRANT TECHNOLOGIES,Quadrant Technologies LLC,35,2,FY2025Q4; FY2026Q1,yes,15-1211; 15-1252,Computer Systems Analysts; Software Developers,CA; FL; GA; TX; WA,Austin; Bothell; Covington; Cumming; Fremont; Jacksonville; Redmond; San Jose; San Ramon; Seabeck,67267,92186,135699
VEEVA SYSTEMS,Veeva Systems Inc.,26,2,FY2025Q4; FY2026Q1,yes,15-1252,Software Developers,CA; CO; OH; TX; WA,Allen; Arvada; Bellevue; Dublin; Los Angeles; Pleasanton; Pleasaonton,95000,130250,142000
ARTIFINT TECHNOLOGIES,ARTIFINT TECHNOLOGIES LLC,24,2,FY2025Q4; FY2026Q1,yes,15-1211; 15-1252,Computer Systems Analysts; Software Developers,CA; FL; GA; IN; MI; MO; NC; NY; PA; TN; TX; VA,AUSTIN; BERWYN; CHARLOTTE; CHELSEA; DALLAS; DULUTH; INDIANAPOLIS; KING OF PRUSSIA; MCLEAN; MEMPHIS; NASHVILLE; NEW YORK; ORLANDO; RESTON; RICHARDSON; RICHMOND; SACRAMENTO; SAN DIEGO; ST LOUIS; TROY,73840,88088,103210
ANTRA,"Antra, Inc.",23,2,FY2025Q4; FY2026Q1,yes,15-1252,Software Developers,CA; IA; IL; MA; MD; NC; NJ; NY; PA; TX; VA,Ashburn; Austin; Brooklyn; Chicago; Durham; Jersey City; Johnston; Malden; Malvern; Sacramento; Santa Cruz; Staten Island; Sterling; Tracy; Vienna; Windsor Mill; Woodlawn,80000,95500,103500
COSTCO WHOLESALE CORPORATION,Costco Wholesale Corporation,23,2,FY2025Q4; FY2026Q1,yes,15-1252,Software Developers,TX; WA,Dallas; Issaquah,130000,140000,148600
IDEXCEL,Idexcel Inc,23,2,FY2025Q4; FY2026Q1,yes,15-1252,Software Developers,DC; FL; GA; KS; PA; TX; VA,Arlington; Ashburn; Atlanta; Austin; Brambleton; Cumming; Deerfield Beach; Farmers Branch; Little Elm; MCLean; Malvern; McLean; Reston; Topeka; Washington,77000,101500,5200000
SAGE IT,SAGE IT INC,22,2,FY2025Q4; FY2026Q1,yes,15-1252,Software Developers,AL; AZ; GA; NC; NJ; TX,Atlanta; Aubrey; Austin; Charlotte; FRISCO; Frisco; Jersey City; Montgomer; Montgomery; Phoenix; Plano,67766,90896,103210
DOORDASH,"DoorDash, Inc.",20,2,FY2025Q4; FY2026Q1,yes,15-1252,Software Developers,CA; NY; WA,New York; San Francisco; Seattle; Sunnyvale,140100,153600,188000
SOFTWORLD TECHNOLOGIES,Softworld Technologies LLC,20,2,FY2025Q4; FY2026Q1,yes,15-1252,Software Developers,AR; AZ; MN; NJ; NY; OH; TX; VA,Bentonville; Blue Ash; Columbus; Coppell; Eagan; Jersey City; McLean; New York; Phoenix; Plano; St Paul,82000,91000,103500
FEDERAL SOFT SYSTEMS,Federal Soft Systems Inc.,19,2,FY2025Q4; FY2026Q1,yes,15-1211; 15-1252,Computer Systems Analysts; Software Developers,FL; IL; KS; NC; OH; TX; VA,Charlotte; Chicago; Corpus Christi; Denton; Frisco; Fuquay Varina; LEANDER; Leesburg; Miami; Morrow; Overland Park; Plano,76086,85467,101421
TIKTOK U S DATA SECURITY,TikTok U.S. Data Security Inc.,18,2,FY2025Q4; FY2026Q1,yes,15-1252,Software Developers,CA; WA,Bellevue; San Jose,117749,149365,187000
FIDELITY TECHNOLOGY GROUP LLC D B A FIDELITY INVESTMENTS,"Fidelity Technology Group, LLC d/b/a Fidelity Investments",17,2,FY2025Q4; FY2026Q1,yes,15-1252,Software Developers,NC; NH; TX; UT,Durham; Merrimack; Salt Lake City; Westlake,80583,94182,103210
BYTEDANCE,BYTEDANCE INC.,15,2,FY2025Q4; FY2026Q1,yes,15-1252,Software Developers,CA; WA,Bellevue; San Jose,117749,160000,185000
LEAD IT CORPORATION,Lead IT Corporation,15,2,FY2025Q4; FY2026Q1,yes,15-1211; 15-1252; 15-1299,"Computer Occupations, All Other; Computer Systems Analysts; Information Security Engineers; Information Technology Project Managers; Software Developers",AZ; CA; IL; MD; NC; TX; WA,Austin; Bothell; Charlotte; Frederick; Irving; Leander; Mountain View; Normal; Phoenix; Roanoke; Villa park,66352,90355,117749
KARWELL TECHNOLOGIIES,"KARWELL TECHNOLOGIIES, INC.",14,2,FY2025Q4; FY2026Q1,yes,15-1211; 15-1252,Computer Systems Analysts; Software Developers,AZ; IL; NC; NJ; NY; PA; TX,CHARLOTTE; GRAPEVINE; HARRISBURG; HARRISON; NEW YORK; NEWARK; PHOENIX; PLANO; RARITAN; ROSEMONT; THE WOODLANDS,75171,97885,104333
MPHASIS CORPORATION,Mphasis Corporation,14,2,FY2025Q4; FY2026Q1,yes,15-1252; 15-1299,Information Technology Project Managers; Software Developers,CA; DE; GA; IL; NJ; OH; PA; TX,Arlington Heights; Atlanta; COLUMBUS; Cumming; Fremont; Jersey City; Lake Hiawatha; PITTSBURGH; Pittsburgh; Sandy Springs; Spring; Wilmington,86418,110000,130000
3I INFOTECH,3i INFOTECH INC.,13,2,FY2025Q4; FY2026Q1,yes,15-1211; 15-1252; 15-1299,Computer Systems Analysts; Information Technology Project Managers; Software Developers,AZ; CA; FL; NY; SC; TX; VA,ALBANY; APT. #2208; FORT MILL; FREMONT; HOUSTON; IRVING; MCLEAN; NEW YORK; PHOENIX; ROUND ROCK; SAN ANTONIO; TAMPA,70000,88000,103210
ENVIRONMENTAL SYSTEMS RESEARCH INSTITUTE,"Environmental Systems Research Institute, Inc.",13,2,FY2025Q4; FY2026Q1,yes,15-1252,Software Developers,CA; NY,New York City; Redlands,101774,123510,150280
STRATEGIC SYSTEMS,"Strategic Systems, Inc.",13,2,FY2025Q4; FY2026Q1,yes,15-1252,Software Developers,CT; GA; NC; NJ; NY; TX; VA,Atlanta; Aubrey; Charlotte; Hartford; Irving; McKinney; McLean; New York; Plano; Princeton; Reston,90000,91291,103210
TECH TAMMINA,"Tech Tammina, LLC",13,2,FY2025Q4; FY2026Q1,yes,15-1252,Software Developers,CA; DC; MA; MD; MI; NJ; TX,Farmington Hills; Germantown; Irvine; Iselin; Katy; Newark; Newport Beach; North Quincy; Raritan; Washington,84053,101421,135699
NISUM TECHNOLOGIES,Nisum Technologies Inc.,12,2,FY2025Q4; FY2026Q1,yes,15-1252,Software Developers,CA,Dublin; Pleasanton; Rocklin; San Francisco; San Jose,120000,146906,158267
BNS INTERNATIONAL,BNS INTERNATIONAL INC,11,2,FY2025Q4; FY2026Q1,yes,15-1252,Software Developers,CA; MN; NJ; PA; TX,AUBREY; Dallas; Eden Prairie; Houston; IRVINE; MCKINNEY; Malvern; TRENTON,85821,90896,102232
COLLABORATE SOLUTIONS,Collaborate Solutions Inc.,11,2,FY2025Q4; FY2026Q1,yes,15-1252,Software Developers,CA; GA; NY; TX; VA,Atlanta; Aubrey; Irving; Mountain House; New York; Plano; Richardson; Richmond; San Antonio,87859,90896,103210
SARAS AMERICA,SARAS AMERICA INC.,11,2,FY2025Q4; FY2026Q1,yes,15-1211; 15-1252; 15-1299,"Computer Occupations, All Other; Computer Systems Analysts; Software Developers",MI; MO; OH; TX; WA,FARMINGTON; Frisco; Grove City; Lake Stevens; Liberty Hill; St Charles,70000,84100,91000
SRI TECH SOLUTIONS,"SRI Tech Solutions, Inc.",11,2,FY2025Q4; FY2026Q1,yes,15-1252; 15-1299,Software Developers; Web Administrators,CA; FL; NC; TX; WA,Austin; Bellevue; Charlotte; McKinney; Mountain View; Sunnyvale; Tampa,78374,90355,149365
VENTURESOFT GLOBAL,VENTURESOFT GLOBAL INC,11,2,FY2025Q4; FY2026Q1,yes,15-1211; 15-1252,Computer Systems Analysts; Software Developers,CA; IL; MI; TX,Grand Rapids; Leander; PLEASANTON; San Ramon; Tracy; Vernon Hills,63586,98758,135699
DIASPARK,"Diaspark, Inc.",10,2,FY2025Q4; FY2026Q1,yes,15-1252,Software Developers,NC; NJ; NY; TN; TX,Charlotte; Edison; Irving; Nashville; New York; Newark,85200,99750,104000
ERBA SOLUTIONS,ERBA Solutions LLC,10,2,FY2025Q4; FY2026Q1,yes,15-1252,Software Developers,IL; MN; NJ; OH; TX,Addison; Columbus; Jersey City; Justin; Plano; Plymouth,83000,91000,103500
H TOWN TECHNOLOGIES,H-TOWN TECHNOLOGIES INC,10,2,FY2025Q4; FY2026Q1,yes,15-1211; 15-1252,Computer Systems Analysts; Software Developers,CA; MI; NC; TX,Auburn Hills; Charlotte; HOUSTON; Katy; Orange,73840,84094,91291
KANAP SYSTEMS,Kanap Systems LLC,10,2,FY2025Q4; FY2026Q1,yes,15-1252,Software Developers,AZ; NJ; NY; TX; VA; WA,East Greenbush; Henrico; MORRIS PLAINS; Mt Laurel; New York; Phoenix; Plano; Princeton; Seattle,80000,99105,117749
MOXIE IT SOLUTIONS,Moxie IT Solutions Inc,10,2,FY2025Q4; FY2026Q1,yes,15-1252,Software Developers,AZ; MN; SC; TX; VA,Ashburn; Fort Mill; Hopkins; Houston; PLANO; Phoenix; Reston; Richmond,88000,92150,101500
NAMITUS TECHNOLOGIES,Namitus Technologies Inc,10,2,FY2025Q4; FY2026Q1,yes,15-1252,Software Developers,AZ; TX,Aubrey; Dallas; Frisco; Grand Prairie; Phoenix; Plano,84120,90900,90960
THOUGHT CIRCUITS SERVICES,Thought Circuits Services LLC,10,2,FY2025Q4; FY2026Q1,yes,15-1252,Software Developers,NC; NJ; OH; TX; VA,Charlotte; Jersey City; Mclean; Miamisburg; PLANO; Plano,90900,91000,103250
VITOSHA,Vitosha Inc,10,2,FY2025Q4; FY2026Q1,yes,15-1252,Software Developers,FL; IL; NC; OH; TX,Charlotte; Dayton; Georgetown; Helotes; Irving; Jacksonville; Plano; Riverwoods,80000,91000,166400000
AMAZON DATA SERVICES,"Amazon Data Services, Inc",9,2,FY2025Q4; FY2026Q1,yes,15-1252; 15-1299,Information Technology Project Managers; Software Developers,CO; TN; VA; WA,Arlington; Bellevue; Denver; Nashville; Seattle,95784,126500,132900
ANA DATA CONSULTING,"Ana-Data Consulting, Inc.",9,2,FY2025Q4; FY2026Q1,yes,15-1252,Software Developers,GA; NJ; NY; VA; WA,Alpharetta; Bothell; Iselin; Jersey City; McLean; New York; North Bergen; Princeton,100000,103210,110635
BEACON HILL SOLUTIONS GROUP,Beacon Hill Solutions Group LLC,9,2,FY2025Q4; FY2026Q1,yes,15-1252; 15-1299,Information Technology Project Managers; Software Developers,AR; AZ; IA; MA; MI; TX,Argyle; Ayer; Bentonville; Davenport; East Lansing; Phoenix; Westlake,58240,83200,108160
COGNIER,COGNIER INC,9,2,FY2025Q4; FY2026Q1,yes,15-1252,Software Developers,CA; DE; MO; TX; VA,Fredericksburg; Frisco; Houston; Jefferson City; LA PALMA; San Antonio; San Jose; WILMINGTON,62150,85446,149365
DOTCOM TEAM,DOTCOM TEAM LLC,9,2,FY2025Q4; FY2026Q1,yes,15-1252,Software Developers,FL; MA; NJ; TX; WA,ANDOVER; DORAL; LEXINGTON; MELROSE; MOUNT LAUREL; SEATTLE; WESTFORD; WESTLAKE,90000,110000,120000
FOURTH TECHNOLOGIES,Fourth Technologies Inc.,9,2,FY2025Q4; FY2026Q1,yes,15-1252; 15-1299,Computer Systems Engineers/Architects; Software Developers,AL; CA; NJ,Cherry Hill; Hoover; Los Altos; Los Gatos,80000,90000,149500
GANAIT,"GanaIT, Inc.",9,2,FY2025Q4; FY2026Q1,yes,15-1252,Software Developers,AZ; DE; FL; NC,Charlotte; Phoenix; Tampa; Wilmington,78374,88088,91291
INVINCIBLE TECH SYSTEMS,Invincible Tech Systems Inc.,9,2,FY2025Q4; FY2026Q1,yes,15-1211; 15-1252,Computer Systems Analysts; Software Developers,CA; KS; MA; TX,Austin; Boston; Houston; Overland Park; Plano; Sunnyvale,76086,90355,107557
ITLIZE GLOBAL,ITLIZE GLOBAL LLC.,9,2,FY2025Q4; FY2026Q1,yes,15-1252,Software Developers,MD; MI; MO; NJ; PA; TX,COLUMBIA; DEARBORN; EDISON; JERSEY CITY; OWINGS MILLS; PHILADELPHIA; PRINCETON; RICHARDSON; ROCKVILLE,84000,95493,103210
LYFT,"LYFT, Inc.",9,2,FY2025Q4; FY2026Q1,yes,15-1252,Software Developers,CA; NY; WA,New York; San Francisco; Seattle,128000,136000,150000
PAYCOM PAYROLL,"Paycom Payroll, LLC",9,2,FY2025Q4; FY2026Q1,yes,15-1252,Software Developers,OK; TX,Grapevine; Irving; Oklahoma City,115000,123000,150000
PIONEER TEK SERVICES,Pioneer Tek Services Inc,9,2,FY2025Q4; FY2026Q1,yes,15-1252,Software Developers,FL; MO; TX,Celina; Chesterfield; Grapevine; Houston; Lakewood Village; Miami; Plano; San Antonio,76045,90896,90896
RAAS INFOTEK,Raas Infotek LLC,9,2,FY2025Q4; FY2026Q1,yes,15-1252,Software Developers,CA; GA; NC; OR; PA; TX; VA,Alpharetta; Charlotte; Hillsboro; Philadelphia; SAN ANTONIO; San Antonio; San Jose; TYSONS,86000,92000,1068000
ROBOTICS TECHNOLOGIES,ROBOTICS TECHNOLOGIES LLC,9,2,FY2025Q4; FY2026Q1,yes,15-1252; 15-1299,Computer Systems Engineers/Architects; Software Developers,FL; IL; NY; OR; TX; VA,Addison; BEAVERTON; DOWNERS GROVE; MCLEAN; NEW YORK; RICHMOND; TAMPA,58053,90896,103210
SAVIN TECHNOLOGIES,"Savin Technologies,Inc",9,2,FY2025Q4; FY2026Q1,yes,15-1252,Software Developers,AZ; CA; DE; TX,Austin; Fort Worth; San Jose; Tempe; Westlake; Wilmington,85384,90896,149365
TECHNOSOFT CORPORATION,TECHNOSOFT CORPORATION,9,2,FY2025Q4; FY2026Q1,yes,15-1211; 15-1252,Computer Systems Analysts; Software Developers,CO; GA; MI; NM; OR; PA; TX,Alpharetta; Austin; Lansing; Mechanicsburg; Parker; Salem; Santa Fe,70803,85384,98738
VERKADA,"Verkada, Inc",9,2,FY2025Q4; FY2026Q1,yes,15-1211; 15-1252; 15-1299,Computer Systems Analysts; Computer Systems Engineers/Architects; Software Developers,CA,San Mateo; San Mato,106080,150000,155000
ACEINTEGRATOR,ACEINTEGRATOR INC,8,2,FY2025Q4; FY2026Q1,yes,15-1252,Software Developers,CA; GA; NC; NJ; TN; VA,Alpharetta; Charlotte; Milpitas; Nashville; Parsippany; Tysons,85000,98750,149365
AVANI TECHNOLOGY SOLUTIONS,"Avani Technology Solutions, Inc.",8,2,FY2025Q4; FY2026Q1,yes,15-1252,Software Developers,NC; NJ; NY; TX; VA,Charlotte; Iselin; Little Elm; Rochester; Sterling,77000,91500,105000
CIBERLYNX,Ciberlynx Inc,8,2,FY2025Q4; FY2026Q1,yes,15-1252,Software Developers,CT; FL; MA; PA; TX; VA,Boston; Hartford; Irving; Manassas; Pittsburgh; Richmond; Sunrise,73757,88442,107557
ECCLESIASTES,"ECCLESIASTES, INC.",8,2,FY2025Q4; FY2026Q1,yes,15-1252; 15-1299,Computer Systems Engineers/Architects; Software Developers,AZ; GA; MN; NC; TX,CHARLOTTE; DULUTH; EAGAN; FRISCO; MINNEAPOLIS; PHOENIX,66726,87651,91291
HOLLERITH IT SOLUTIONS,HOLLERITH IT SOLUTIONS LLC,8,2,FY2025Q4; FY2026Q1,yes,15-1252,Software Developers,IL; TX; VA,Evanston; Glen Allen; Houston; McLean; Pearland,83637,84094,101421
INSIGHT GLOBAL,"Insight Global, LLC",8,2,FY2025Q4; FY2026Q1,yes,15-1252,Software Developers,CA; GA; RI; TX; WA,Alpharetta; Aubrey; Bellevue; Cranston; Irving; San Jose; Seattle,87859,104322,149365
KALPRA TECH SOLUTIONS,Kalpra Tech Solutions LLC,8,2,FY2025Q4; FY2026Q1,yes,15-1252; 15-1299,Information Technology Project Managers; Software Developers,NC; TX; WA,Charlotte; Houston; KATY; Redmond,83824,84297,91291
MEBHAZ,Mebhaz Inc.,8,2,FY2025Q4; FY2026Q1,yes,15-1252,Software Developers,MD; PA; TX; VA,Aubrey; Bensalem; Chantilly; Houston; SUGARLAND; Woodlawn,84094,86544,101421
OPTIMAL TECHNOLOGIES,"Optimal Technologies, Inc.",8,2,FY2025Q4; FY2026Q1,yes,15-1252,Software Developers,CA; GA; MI; NJ; TX,Alpharetta; Farmington Hills; Fort Worth; Fremont; Little Elm; Parsippany; Plano,87859,90896,135699
RAVEN SOFTWARE SOLUTIONS,Raven Software Solutions Inc,8,2,FY2025Q4; FY2026Q1,yes,15-1252,Software Developers,AR; CA; PA; TX,Bentonville; Coppell; Farmers Branch; Fremont; Harrisburg; Irving; Pleasanton,64376,90896,135699
REDSHIFT TECHNOLOGIES,RedShift Technologies LLC,8,2,FY2025Q4; FY2026Q1,yes,15-1252,Software Developers,FL; TX,Dallas; Fort Worth; Irving; Plano; Tampa,78374,90896,91000
TECHPRO SOLUTIONS,"TECHPRO SOLUTIONS, INC.",8,2,FY2025Q4; FY2026Q1,yes,15-1252; 15-1299,Information Security Engineers; Software Developers,DE; GA; IL; NY; PA; TX; UT,ALPHARETTA; AUSTIN; BUFFALO GROVE; CHICAGO; MALVERN; MIDVALE; NEW YORK; Wilmington,65000,88050,95000
TIKTOK,TikTok Inc.,8,2,FY2025Q4; FY2026Q1,yes,15-1252,Software Developers,CA; WA,Bellevue; Culver City; San Jose,102232,153002,170880
VENNISON TECHNOLOGIES,VENNISON TECHNOLOGIES INC,8,2,FY2025Q4; FY2026Q1,yes,15-1252,Software Developers,NC; TX,Austin; Charlotte; Cypress; Georgetown; Lewisville; Manor; Sherman,87360,91250,91520
BYTE LINK SYSTEMS,BYTE LINK SYSTEMS INC,7,2,FY2025Q4; FY2026Q1,yes,15-1211; 15-1252,Computer Systems Analysts; Software Developers,GA; OR; TX,AUBREY; BEAVERTON; HOUSTON; PLANO; SANDY SPRINGS,80000,91000,103000
CAMELOT INTEGRATED SOLUTIONS,Camelot Integrated Solutions Inc,7,2,FY2025Q4; FY2026Q1,yes,15-1252,Software Developers,GA; IL; MA; TX; WA,Boston; George Town; Irving; Lisle; Marietta; Westlake; Woodinville,85467,90896,117749
DATAQUAD,Dataquad Inc.,7,2,FY2025Q4; FY2026Q1,yes,15-1252,Software Developers,KY; OH; SC; TX,Austin; COLUMBUS; Columbus; Indian Land; Irving; Lexington,82846,91000,91291
EMONICS,Emonics LLC,7,2,FY2025Q4; FY2026Q1,yes,15-1299,Computer Systems Engineers/Architects,CA; IA,San Jose; Sunnyvale; West Des Moines,62525,97594,97594
ENCORA DIGITAL,Encora Digital LLC,7,2,FY2025Q4; FY2026Q1,yes,15-1252,Software Developers,NJ,Englewood Cliffs; Saddle Brook; South Brunswick,103210,103210,130000
EUREKA INFOTECH,EUREKA INFOTECH INC,7,2,FY2025Q4; FY2026Q1,yes,15-1252,Software Developers,AZ; CA; NY; OH; VA,McLean; New York; Peoria; San Leandro; Westerville,82900,86500,130250
INFOCONS,Infocons Inc,7,2,FY2025Q4; FY2026Q1,yes,15-1252,Software Developers,NJ; NY; PA,Albany; Exton; Lake Hiawatha; West Chester,85000,88088,103210
JOLTTEK,JOLTTEK INC,7,2,FY2025Q4; FY2026Q1,yes,15-1252,Software Developers,DE; IL; NY; TX,New York; Princeton; Riverwoods; Wilmington,90000,91000,103210
META PLATFORMS,"Meta Platforms, Inc",7,2,FY2025Q4; FY2026Q1,yes,15-1252,Software Developers,CA; MI; NY; WA,Farmington Hills; Menlo Park; New York; Seattle,133212,139000,169177
OPEN AVENUES FOUNDATION,Open Avenues Foundation,7,2,FY2025Q4; FY2026Q1,yes,15-1252,Software Developers,NJ; NY,Long Island City; New York; Union City; Wyckoff,103210,103210,103210
SLESHA,Slesha Inc,7,2,FY2025Q4; FY2026Q1,yes,15-1252,Software Developers,CA; IL; OR; TX; VA,Beaverton; CHICAGO; Irving; PLANO; RICHMOND; SUNNYVALE; TRACY,83637,90896,149365
TANISHA SYSTEMS,TANISHA SYSTEMS INC,7,2,FY2025Q4; FY2026Q1,yes,15-1252; 15-1299,"Computer Occupations, All Other; Computer Systems Engineers/Architects; Software Developers",GA; IL; NC; TX; WA,BOTHELL; Chicago; Concord; Cumming; The Colony,64397,83824,91300
VAK IT SYSTEMS,Vak IT Systems Inc,7,2,FY2025Q4; FY2026Q1,yes,15-1252,Software Developers,CA; PA; TX; VA,FRESNO; MALVERN; PLANO; RICHMOND; SUNNYVALE,83637,88088,149365
VEDHOPS IT SERVICES,VEDHOPS IT SERVICES LLC,7,2,FY2025Q4; FY2026Q1,yes,15-1252,Software Developers,MO; NY; TX,Aubrey; LIVE OAK; Live Oak; NewYork; Saint Charles,79899,87000,103210
WALL STREET CONSULTING SERVICES,WALL STREET CONSULTING SERVICES LLC,7,2,FY2025Q4; FY2026Q1,yes,15-1252,Software Developers,NJ; NY; PA; TN,Albany; Bldg. 12; Edison; Harrisburg; Nashville; Princeton; Trenton,84490,86000,103210
WISE GEN,WISE GEN INC,7,2,FY2025Q4; FY2026Q1,yes,15-1252,Software Developers,FL; GA; IL; OH; TX,AUBREY; CHICAGO; DUNWOODY; GEORGETOWN; Lewis Center; Riverview,78374,90355,177771360
APPLIED INTUITION,"Applied Intuition, Inc.",6,2,FY2025Q4; FY2026Q1,yes,15-1252,Software Developers,CA,Mountain View; Sunnyvale,149365,160000,175000
AROHAK,Arohak Inc,6,2,FY2025Q4; FY2026Q1,yes,15-1211; 15-1252,Computer Systems Analysts; Software Developers,CA; NJ; NY,Mahwah; New York; Raritan; San Diego,94000,103500,105000
AVCO CONSULTING,"Avco Consulting, Inc.",6,2,FY2025Q4; FY2026Q1,yes,15-1252; 15-1299,Information Security Engineers; Software Developers,FL; MA; PA; TX; VA,Austin; Framingham; Mechanicsburg; Richmond; SOUTHLAKE; Wesley Chapel,75000,82462,120640
CARNEGIE MELLON UNIVERSITY,Carnegie Mellon University,6,2,FY2025Q4; FY2026Q1,yes,15-1252,Software Developers,IL; PA,Champaign; Pittsburgh,67829,77500,126690
CHARTER COMMUNICATIONS,"Charter Communications, Inc.",6,2,FY2025Q4; FY2026Q1,yes,15-1252,Software Developers,CO; MO; NC,Charlotte; Greenwood Village; Maryland Heights,80300,80300,98738
CLEVERSMITHS,Cleversmiths Inc,6,2,FY2025Q4; FY2026Q1,yes,15-1252; 15-1299,Information Technology Project Managers; Software Developers,CA; NC; TX; VA,Arlington; Charlotte; Irving; Rancho Cucamonga; Sunnyvale,90896,91322,97594
CLOUDVIK,CloudVik LLC,6,2,FY2025Q4; FY2026Q1,yes,15-1252,Software Developers,FL; NJ; TX; UT,Fort Worth; Melbourne; Plano; Salt Lake City; Weehawken Township,80538,88494,103210
CLOUDZENIX,CloudZenix LLC,6,2,FY2025Q4; FY2026Q1,yes,15-1252,Software Developers,TX,Coppell; Irving,84094,90896,90896
CODE GRAVITY,Code Gravity LLC,6,2,FY2025Q4; FY2026Q1,yes,15-1252,Software Developers,IL; NC; TX,Chicago; Irving; Lewisville; Mooresville,85467,90896,92000
ENDAVA SOLUTIONS,"Endava Solutions, LLC",6,2,FY2025Q4; FY2026Q1,yes,15-1252,Software Developers,FL; IL; NJ,Flemington; Parsippany; Schaumburg; Tampa,78374,81920,103210
ERPLABS,ERPLabs Inc,6,2,FY2025Q4; FY2026Q1,yes,15-1252,Software Developers,AZ; CA,Aliso Viejo; Folsom; Scottsdale; Sunnyvale,87651,101224,149365
FLYHIGH STAFFING,Flyhigh Staffing LLC,6,2,FY2025Q4; FY2026Q1,yes,15-1252,Software Developers,GA; NJ; PA,Atlanta; Jersey City; Malvern; Newark; Princeton,87859,89492,103210
FPT USA CORPORATION,FPT USA Corporation,6,2,FY2025Q4; FY2026Q1,yes,15-1252; 15-1299,Computer Systems Engineers/Architects; Software Developers,CO; FL; GA; NC; TX,Aurora; Johns Creek; Liberty; Tomball; Winter Park,86100,90125,95041
GLOBAL SUMI TECHNOLOGIES,GLOBAL SUMI TECHNOLOGIES INC,6,2,FY2025Q4; FY2026Q1,yes,15-1252,Software Developers,MD; NY; TX; VA,BROOKLYN; FREDERICK; GLEN ALLEN; IRVING,84500,94250,103500
INTELLISOFT TECHNOLOGIES,Intellisoft Technologies,6,2,FY2025Q4; FY2026Q1,yes,15-1252,Software Developers,VA,Fairfax,101421,101421,101421
JKV INTERNATIONAL,JKV International LLC,6,2,FY2025Q4; FY2026Q1,yes,15-1252,Software Developers,GA,Atlanta,91291,91520,101920
KIAN,Kian Corp,6,2,FY2025Q4; FY2026Q1,yes,15-1211,Computer Systems Analysts,AR; CA; MD; TX; WA,Austin; Bentonville; McKinney; New Market; Redmond; San Jose,60674,81037,101920
NYC GRAVITYNET,NYC Gravitynet LLC,6,2,FY2025Q4; FY2026Q1,yes,15-1252,Software Developers,NY; PA,Melville; PHILADELPHIA,88088,103210,103210
POPULUS GROUP,Populus Group LLC,6,2,FY2025Q4; FY2026Q1,yes,15-1211; 15-1252,Computer Systems Analysts; Software Developers,CA; FL; KY; NY; WA,Bellevue; Frankfort; Miami; New York; San Francisco,74880,87100,157040
QUALYS,"QUALYS, INC.",6,2,FY2025Q4; FY2026Q1,yes,15-1252,Software Developers,CA; NC,Foster City; Raleigh,91707,135699,149365
RELEVANTZ TECHNOLOGY SERVICES,"Relevantz Technology Services, Inc.",6,2,FY2025Q4; FY2026Q1,yes,15-1252,Software Developers,FL; GA; MA; PA,Alpharetta; Lake Mary; Pittsburgh; Westborough,88000,103000,126000
ROCKET MORTGAGE,"Rocket Mortgage, LLC",6,2,FY2025Q4; FY2026Q1,yes,15-1252,Software Developers,AZ; MA; MI; MN; NC,Blaine; Charlotte; Lansing; Malden; Phoenix,85000,87750,107557
SAVI TECHNOLOGIES,"Savi Technologies, Inc.",6,2,FY2025Q4; FY2026Q1,yes,15-1252,Software Developers,CA; GA; NC; TX,Charlotte; Dallas; Lathrop; Leander; Suwanee,88000,90667,102232
SHOOLIN,Shoolin Inc,6,2,FY2025Q4; FY2026Q1,yes,15-1252; 15-1299,"Computer Occupations, All Other; Software Developers",CA; NJ; PA; WA,Alameda; BERKELEY HEIGHTS; Bellevue; GILBERTSVILLE; Gilbertsville,88192,98176,117749
SLK AMERICA,SLK AMERICA INC,6,2,FY2025Q4; FY2026Q1,yes,15-1252,Software Developers,FL; NY; OH; TN,Buffalo; Cincinnati; Jacksonville; MEMPHIS,78686,80724,101255
SOURCE CONSULTING,"Source Consulting, LLC",6,2,FY2025Q4; FY2026Q1,yes,15-1252,Software Developers,FL; MA; TX,Austin; Lauderhill; Lewisville; McKinney; Norwood,90000,91000,108000
SUNSOFT SERVICES,SUNSOFT SERVICES INC,6,2,FY2025Q4; FY2026Q1,yes,15-1211; 15-1252,Computer Systems Analysts; Software Developers,AR; FL; NY,Bentonville; Miami; New York,70000,83658,84000
SYNAPSE TECH SERVICES,Synapse Tech Services Inc.,6,2,FY2025Q4; FY2026Q1,yes,15-1211; 15-1252; 15-1299,Computer Systems Analysts; Computer Systems Engineers/Architects; Software Developers,MI; NC; OH; PA; TX,Auburn Hills; Charlotte; Columbus; Greencastle; Liberty Hill,73000,84526,95000
TECHCOGNIZE,TechCognize Inc.,6,2,FY2025Q4; FY2026Q1,yes,15-1252,Software Developers,TX; VA,Irving; McLean; Plano,90896,90896,101421
